intent,response,intent_special_chars,response_special_chars
heatwaves Home Remedies,"1.glass of  buttermilk,A pinch of salt,1 teaspoon of sugar A few drops of lemon juice mix well which helps for  Preventing dehydration Soothes the stomach and  Balances electrolytes in body                                                                            
                                                                         2    

Take fresh ash gourd, cut it into pieces, and grind well to extract the juice. Filter it and take 15 to 20 ml of the juice, adding a little sugar for taste. Consume this 3 to 4 times a day to keep the body hydrated and protect against heat waves.",['_'],[]
heatwaves Diets,"Drink more water stored in a mud pot, as it has a natural cooling effect. Consume juices made from seasonal fruits. Eat curd rice and drink buttermilk, which are rich in probiotics. Include fruits like muskmelon and watermelon in your diet. Also, eat sabudana (sago) for better digestion and energy",['_'],"['(', ')']"
Headache Naturopathy Remedies,drink more water which is up to 4 to 5 liters to get your body cool and some electrolytes like coconut water,['_'],[]
Headache  Ayurvedic Remedies,Take a handful of coriander seeds (dhaniyalu) and mix them with a little water to make a thick paste. Apply this paste to the affected area (maadu),['_'],"['(', ')', '(', ')']"
BP,Let me know which type of services do you want for BP?,[],[]
BP Diet,BP Diet Information,['_'],[]
Diarrhea Medication,"LOPAMIDE (Lopamide hydrochloride tablets I.P.)  Dose-2mg cause-Lopamide Tablet is an anti-diarrhoeal medication. It works by slowing down the contraction of the intestines thereby decreasing the speed at which the contents pass through it. This allows more time for reabsorption of fluids and nutrients, making the stools more solid and less frequent.",['_'],"['(', ')']"
BP,Let me know which type of services do you want for BP?,[],[]
Confirm Stress Symptoms,"Stress can affect both the mind and body, leading to symptoms like headaches, muscle tension, fatigue, irritability, trouble sleeping, difficulty concentrating, and digestive issues,                                                    Managing stress through relaxation techniques, exercise, and a balanced diet can help","['_', '_']",[]
Headache  Ayurvedic Remedies,Take a handful of coriander seeds (dhaniyalu) and mix them with a little water to make a thick paste. Apply this paste to the affected area (maadu),['_'],"['(', ')', '(', ')']"
BP symptom check,choose which type of symptom most relevent to you for bp,"['_', '_']",[]
Vomitings Remedies,Please let me know which type of remedies do you want?,['_'],[]
Welocme Intent,"Welcome to our MedicalBot, these are the service available in this bot.",['_'],[]
Confirm Physical Stress,"Physical stress occurs when the body is overworked due to excessive physical activity,To manage physical stress, get enough rest, stay hydrated, eat a balanced diet, and practice relaxation techniques like stretching or deep breathing,If symptoms persist, consult a doctor","['_', '_']",[]
Confirm Common Constipation,"I can't determine other constipation-related symptoms. If you're experiencing severe or unusual symptoms, please consult your doctor for proper evaluation and guidance","['_', '_']",[]
heatwaves Ayurvedic Remedies,"Take equal amounts of Tippatiga (Balloon Vine) dried leaves, Usori Gavaravu (Gooseberry), and Parpatakam (Fumaria Indica) and grind them into a fine powder. Take 20 to 30 grams of this powder and add it to 4 glasses of water. Boil the mixture until it reduces to 1 glass,For best results, consume 2 to 3 tablespoons of the warm decoction morning and evening.",['_'],"['(', ')', '(', ')', '(', ')']"
Fever Home Remedies,"Take 5 grams of coriander seeds (Dhaniyalu), 3 grams of cumin seeds (Jeelakarra), and 5 grams of ginger, and lightly crush them. Add this mixture to a glass of boiling water and let it simmer until the liquid reduces to one-fourth of its original quantity. Strain the decoction and drink it warm to help reduce fever and chills if your symptoms getting worse please consult your doctor",['_'],"['(', ')', '(', ')']"
heatwaves Remedies,please tell me which type of remedies do you want?,['_'],[]
Confirm Mental Stress,"Mental stress can affect your thoughts, emotions, and overall well-being,To manage mental stress, try mindfulness, deep breathing, meditation, and taking breaks.if the symptoms are getting worse please professionals help which can beneficial","['_', '_']",[]
Other illeness Migraine,Mint leaves with hot water can helps to reduction of head ache(migraine) please check the severity and do accordingly,"['_', '_']","['(', ')']"
Fever Naturopathy Remedies,"sleep with an cotton cloth which covers your body on an plain and even bed with a bedsheet on it and now cover your body with wet bead sheet and sleep for few minutes,this even helpful for your high temperature,even though you are repeating with your symptoms please consult your physician",['_'],[]
Vomitings Remedies,Please let me know which type of remedies do you want?,['_'],[]
BP Ayurvedic Remedies,"Add garlic to your diet to help reduce high blood pressure. Fenugreek contains calcium, fiber, and helps reduce bad cholesterol. Dark chocolate also helps reduce hypertension. Eat bananas for a good potassium intake, which helps lower blood pressure",['_'],[]
Constipation Symptom Check,please check your constipation symptoms,"['_', '_']",[]
Diarrhea Medication,"LOPAMIDE (Lopamide hydrochloride tablets I.P.)  Dose-2mg cause-Lopamide Tablet is an anti-diarrhoeal medication. It works by slowing down the contraction of the intestines thereby decreasing the speed at which the contents pass through it. This allows more time for reabsorption of fluids and nutrients, making the stools more solid and less frequent.",['_'],"['(', ')']"
Headache  Ayurvedic Remedies,Take a handful of coriander seeds (dhaniyalu) and mix them with a little water to make a thick paste. Apply this paste to the affected area (maadu),['_'],"['(', ')', '(', ')']"
Hairfall Naturopathy Remedies,"Take Drumstick leaves 2 cups,half cup curd,1/3cup amla powder make whole as paste and apply to your scalp and let it be half an hour and dhead bath,do this twice a week  which helps for mosturizing your scalp",['_'],['/']
Other illeness Piles,lemon with milk immediate consumption  can helps for piles,"['_', '_']",[]
BP remedies,Please let me know which type of BP remedies do you want?,['_'],[]
Vomitings Home Remedies,"Take equal amounts of ginger and onion, grind them into a paste, and filter it to extract the liquid. Consume this liquid every 2 hours and observe the result.",['_'],[]
Confirm Cluster Headache,"Cluster headaches are extremely painful headaches that occur in cycles, usually affecting one side of the head, often around the eye,To manage symptoms, maintain a consistent sleep schedule, avoid known triggers, and practice relaxation techniques. If episodes are frequent or severe, consult a doctor for medical treatment.","['_', '_']",[]
Cold Symptom Check,could you please tell me which type of cold symptoms do you have?,"['_', '_']",[]
Cold Ayurvedic Remedies,"Take fresh Tulasi leaves, grind them into a paste, and filter the extract using a cloth. Add one spoon of pepper powder to the extract and drink it with water in the morning and evening. Due to its antiviral properties, this remedy helps relieve cough and a sore throat",['_'],[]
Vomitings,please let me know which type of services do you want?,[],[]
Confirm Low BP,"Your symptoms suggest low blood pressure. While I can provide basic information, a medical professional is best suited to assess your condition. Please consider seeking medical advice from a doctor for appropriate care.","['_', '_']",[]
BP yoga,Practice Sasankasana and Sheetkari Pranayama (Cooling Pranayama) to help manage blood pressure.,['_'],"['(', ')']"
heatwaves Ayurvedic Remedies,"Take equal amounts of Tippatiga (Balloon Vine) dried leaves, Usori Gavaravu (Gooseberry), and Parpatakam (Fumaria Indica) and grind them into a fine powder. Take 20 to 30 grams of this powder and add it to 4 glasses of water. Boil the mixture until it reduces to 1 glass,For best results, consume 2 to 3 tablespoons of the warm decoction morning and evening.",['_'],"['(', ')', '(', ')', '(', ')']"
Confirm common Cold,"It looks like you may have common cold symptoms (caused by the Rhinovirus), which can result from allergies, infections, low immunity, or exposure to infected individuals. If you’d like, I can suggest remedies, diet tips, and activities to help manage your symptoms. For further evaluation, please consult a doctor.","['_', '_']","['(', ')', '’', '""']"
Vomitings Medication,"Domperidone tablets I.P.   Dose-10mg Cause-Domperidone  10 MG Tablet is an effective anti-emetic medicine used to relieve nausea and vomiting caused by delayed gastric emptying (the time it takes for food to empty from the stomach and enter the small intestine). It increases intestinal movements and facilitates the emptying of the bowel. It is used alone or in combination with other medicines for relieving nausea, vomiting and indigestion   2.Domperidone syrup - Helps with nausea and vomiting caused by delayed stomach emptying.",['_'],"['(', ')']"
Default Fallback Intent,Say that one more time?,[],[]
Confirm Sinus Headache,"A sinus headache occurs due to inflammation or congestion in the sinuses, often caused by infections, allergies, or cold weather,To relieve it, try steam inhalation, stay hydrated, use a warm compress, and avoid allergens. If symptoms persist or worsen, consult a doctor","['_', '_']",[]
Cough Diet,This is an pasting technique which is for 2 to 3 by taking lemon and honey water with some addition coconut water as a diet with steam inhaling hot water bath after 2 to 3 days based on your sickness drink plenty of water at morning a nd then honey water up to your lunch  and then evening take good fruit meat with some boiled vegetables,['_'],[]
BP medication,"CARDIGLOW-H40(Telmisartan and Hydrochlorothiazide Tablets IP) dose-40mg, Cause-  used to treat high blood pressure (hypertension).please check the medicine while using and consult your doctor",['_'],"['(', ')', '(', ')']"
Constipation Remedies,Let me know which type of remedies do you want?,['_'],[]
Confirm Heat Waves,"Heat waves can cause extreme temperatures, leading to dehydration, heat exhaustion, and even heatstroke,,To stay safe, drink plenty of water, wear light clothing, avoid direct sun exposure. If you experience severe symptoms, seek medical attention immediately.","['_', '_']",[]
Hairfall,Which type of services do you want for Hairfall?,[],[]
heatwaves Remedies,please tell me which type of remedies do you want?,['_'],[]
Constipation Medication,"TOPLAC (Lactulose Solution USP), Dose- 10gm/15ml, cause- Lactulose is used to treat constipation. It helps increase the number of bowel movements per day and the number of days on which bowel movements occur in patients with a history of chronic (long-lasting) constipation",['_'],"['(', ')', '/', '(', ')']"
Other illeness Fits,coriander leaves or powder with hot water can helps for fits patient,"['_', '_']",[]
heatwaves Remedies,please tell me which type of remedies do you want?,['_'],[]
Confirm Stress Symptoms,"Stress can affect both the mind and body, leading to symptoms like headaches, muscle tension, fatigue, irritability, trouble sleeping, difficulty concentrating, and digestive issues,                                                    Managing stress through relaxation techniques, exercise, and a balanced diet can help","['_', '_']",[]
Cough Ayurvedic Remedies,"Chew and eat garlic, as it has antibacterial and antiviral properties. Additionally, take some turmeric with honey to soothe the throat and reduce irritation.

Another effective remedy: To take Karakkaya (Haritaki) powder, add it to boiling water, and let it steep. Pour it into a glass, add some honey, and drink it twice a day for best results.",['_'],"[':', '(', ')']"
Stress yoga,"Chandra Bhedana Pranayama – This practice stimulates the parasympathetic nervous system, helping to relax both the brain and body, promoting a sense of calmness.

Chandra Nadi Pranayama – A cooling and soothing breathing technique that helps balance emotions and reduces stress.

Bhramari Pranayama – Encourages positive thinking by stimulating the amygdala and relaxing the hypothalamus, which helps in emotional regulation and mental calmness.

Sheetali Pranayama – Lowers core body temperature, providing a cooling effect that leaves the body feeling refreshed and relaxed.",['_'],"['–', '–', '–', '–']"
Cold Ayurvedic Remedies,"Take fresh Tulasi leaves, grind them into a paste, and filter the extract using a cloth. Add one spoon of pepper powder to the extract and drink it with water in the morning and evening. Due to its antiviral properties, this remedy helps relieve cough and a sore throat",['_'],[]
Confirm Typhoid,"Typhoid is a bacterial infection that can cause high fever, weakness, and digestive issues.  it's good to consult a doctor for proper diagnosis and treatment. Let me know if you need home remedies or diet tips",['_'],[]
Vomitings Ayurvedic Remedies,"This remedie is useful for healing vomitings,Take equal amounts of cloves (lavangam), cumin seeds (jelakarra), cinnamon (dhalchinachakka), and cardamom. Add a little water and grind them into a paste. Mix this paste with honey and consume it for better health benefits.",['_'],"['(', ')', '(', ')', '(', ')']"
Diarrhea,which type of services do you want for Diarrhea?,[],[]
Stress yoga,"Chandra Bhedana Pranayama – This practice stimulates the parasympathetic nervous system, helping to relax both the brain and body, promoting a sense of calmness.

Chandra Nadi Pranayama – A cooling and soothing breathing technique that helps balance emotions and reduces stress.

Bhramari Pranayama – Encourages positive thinking by stimulating the amygdala and relaxing the hypothalamus, which helps in emotional regulation and mental calmness.

Sheetali Pranayama – Lowers core body temperature, providing a cooling effect that leaves the body feeling refreshed and relaxed.",['_'],"['–', '–', '–', '–']"
Cough Ayurvedic Remedies,"Chew and eat garlic, as it has antibacterial and antiviral properties. Additionally, take some turmeric with honey to soothe the throat and reduce irritation.

Another effective remedy: To take Karakkaya (Haritaki) powder, add it to boiling water, and let it steep. Pour it into a glass, add some honey, and drink it twice a day for best results.",['_'],"[':', '(', ')']"
Constipation,which services do you want for Constipation?,[],[]
Cold Home Remedies,"1.Take a handful of sugar and heat it over a flame until it produces smoke. Close your eyes and inhale the smoke gently through your nose for relief.

2.Additionally, drinking warm milk with turmeric is beneficial. Lack of sleep can weaken immunity, so consuming honey and lemon juice can help. Drinking ginger tea is also a great remedy for boosting immunity and overall health.",['_'],[]
Vomitings Medication,"Domperidone tablets I.P.   Dose-10mg Cause-Domperidone  10 MG Tablet is an effective anti-emetic medicine used to relieve nausea and vomiting caused by delayed gastric emptying (the time it takes for food to empty from the stomach and enter the small intestine). It increases intestinal movements and facilitates the emptying of the bowel. It is used alone or in combination with other medicines for relieving nausea, vomiting and indigestion   2.Domperidone syrup - Helps with nausea and vomiting caused by delayed stomach emptying.",['_'],"['(', ')']"
Cough Home Remedies,"Take a small piece of ginger and mix it with Sindhav Lavana (rock salt). Chew the mixture slowly in your mouth. This remedy is highly effective in relieving dry cough.                                                                                                                      
                                                                                   or                                                                                                           
Take one spoon of ajwain (carom seeds), a small amount of salt, and one clove. Grind them into a fine powder. Chew and swallow this mixture to help relieve chronic cough effectively.",['_'],"['(', ')', '(', ')']"
Fever remedies,may i know which type of remedies do you want,['_'],[]
Headache Diet,"1.Increase water intake to 4 to 5 liters per day to help keep your body cool.
                                                         2.
Drinking enough water supports regular bowel movements (twice a day), helping to cleanse your stomach.
                                                          3.
Maintain a 2-hour gap between drinking water and meals for better digestion.
                                                            4.
Include fresh fruits in your diet for breakfast and in the evening.
                                                             5.
Take regular head baths to stay refreshed.
                                                         6.
Avoid coffee and tea for better health",['_'],"['(', ')']"
Diarrhea Symptom Check,please check your symptoms do you have related to diarrhea,"['_', '_']",[]
Fever Diet,"the foods recomended for fever includes fresh fruits,cooked vegetables,soups(mixed vegetables),coconut water because it is more important to keep your body more hyderated as well some probiotics for good gut health",['_'],"['(', ')']"
Welocme Intent,"Welcome to our MedicalBot, these are the service available in this bot.",['_'],[]
Default Fallback Intent,One more time?,[],[]
Diarrhea Remedies,Please let me know which type of remedies do you want?,['_'],[]
Confirm Dengue,"This symptoms looks like dengue fever,Dengue fever is a viral infection transmitted by mosquitoes,I it is very important to consult your doctor for good treatment",['_'],[]
Other illeness Fits,coriander leaves or powder with hot water can helps for fits patient,"['_', '_']",[]
Confirm High BP,"It looks like you're experiencing symptoms of high blood pressure. While this bot can provide general guidance, it’s important to consult a healthcare professional for an accurate diagnosis and proper treatment. Please reach out to your doctor as soon as possible.","['_', '_']",['’']
Diarrhea Medication,"LOPAMIDE (Lopamide hydrochloride tablets I.P.)  Dose-2mg cause-Lopamide Tablet is an anti-diarrhoeal medication. It works by slowing down the contraction of the intestines thereby decreasing the speed at which the contents pass through it. This allows more time for reabsorption of fluids and nutrients, making the stools more solid and less frequent.",['_'],"['(', ')']"
Hairfall Yoga,"Adho Mukha Svanasana (Downward-Facing Dog), Uttanasana (Standing Forward Bend), Vajrasana (Diamond Pose), and Balayam yoga (rubbing fingernails) please do asanas by practice",['_'],"['(', ')', '(', ')', '(', ')', '(', ')']"
Confirm Gum Motions,this symptoms seems like gum motion please consult your doctor for further checkup,"['_', '_']",[]
Headache Naturopathy Remedies,drink more water which is up to 4 to 5 liters to get your body cool and some electrolytes like coconut water,['_'],[]
heatwaves Diets,"Drink more water stored in a mud pot, as it has a natural cooling effect. Consume juices made from seasonal fruits. Eat curd rice and drink buttermilk, which are rich in probiotics. Include fruits like muskmelon and watermelon in your diet. Also, eat sabudana (sago) for better digestion and energy",['_'],"['(', ')']"
heatwaves Ayurvedic Remedies,"Take equal amounts of Tippatiga (Balloon Vine) dried leaves, Usori Gavaravu (Gooseberry), and Parpatakam (Fumaria Indica) and grind them into a fine powder. Take 20 to 30 grams of this powder and add it to 4 glasses of water. Boil the mixture until it reduces to 1 glass,For best results, consume 2 to 3 tablespoons of the warm decoction morning and evening.",['_'],"['(', ')', '(', ')', '(', ')']"
BP medication,"CARDIGLOW-H40(Telmisartan and Hydrochlorothiazide Tablets IP) dose-40mg, Cause-  used to treat high blood pressure (hypertension).please check the medicine while using and consult your doctor",['_'],"['(', ')', '(', ')']"
Other BP Symptoms,"I understand that you're experiencing other BP symptoms. Since this bot is limited in providing medical diagnoses, I highly recommend consulting a qualified doctor for proper evaluation and treatment","['_', '_']",[]
Confirm Low BP,"Your symptoms suggest low blood pressure. While I can provide basic information, a medical professional is best suited to assess your condition. Please consider seeking medical advice from a doctor for appropriate care.","['_', '_']",[]
heatwaves Remedies,please tell me which type of remedies do you want?,['_'],[]
Cough Remedies,Please let me know which type of remedies do you want?,['_'],[]
Cold,please check which services do you want for cold?,[],[]
Constipation Ayurvedic Remedies,Eat Neem fruit and spit out the seeds. This helps with good bowel movements,['_'],[]
heatwaves Home Remedies,"1.glass of  buttermilk,A pinch of salt,1 teaspoon of sugar A few drops of lemon juice mix well which helps for  Preventing dehydration Soothes the stomach and  Balances electrolytes in body                                                                            
                                                                         2    

Take fresh ash gourd, cut it into pieces, and grind well to extract the juice. Filter it and take 15 to 20 ml of the juice, adding a little sugar for taste. Consume this 3 to 4 times a day to keep the body hydrated and protect against heat waves.",['_'],[]
other illeness Remedies,please check the remedies for other illeness,"['_', '_']",[]
heatwaves Ayurvedic Remedies,"Take equal amounts of Tippatiga (Balloon Vine) dried leaves, Usori Gavaravu (Gooseberry), and Parpatakam (Fumaria Indica) and grind them into a fine powder. Take 20 to 30 grams of this powder and add it to 4 glasses of water. Boil the mixture until it reduces to 1 glass,For best results, consume 2 to 3 tablespoons of the warm decoction morning and evening.",['_'],"['(', ')', '(', ')', '(', ')']"
Vomitings Home Remedies,"Take equal amounts of ginger and onion, grind them into a paste, and filter it to extract the liquid. Consume this liquid every 2 hours and observe the result.",['_'],[]
Confirm Physical Stress,"Physical stress occurs when the body is overworked due to excessive physical activity,To manage physical stress, get enough rest, stay hydrated, eat a balanced diet, and practice relaxation techniques like stretching or deep breathing,If symptoms persist, consult a doctor","['_', '_']",[]
Constipation,which services do you want for Constipation?,[],[]
Vomitings,please let me know which type of services do you want?,[],[]
Cold Symptom Check,could you please tell me which type of cold symptoms do you have?,"['_', '_']",[]
heatwaves Ayurvedic Remedies,"Take equal amounts of Tippatiga (Balloon Vine) dried leaves, Usori Gavaravu (Gooseberry), and Parpatakam (Fumaria Indica) and grind them into a fine powder. Take 20 to 30 grams of this powder and add it to 4 glasses of water. Boil the mixture until it reduces to 1 glass,For best results, consume 2 to 3 tablespoons of the warm decoction morning and evening.",['_'],"['(', ')', '(', ')', '(', ')']"
Confirm Cluster Headache,"Cluster headaches are extremely painful headaches that occur in cycles, usually affecting one side of the head, often around the eye,To manage symptoms, maintain a consistent sleep schedule, avoid known triggers, and practice relaxation techniques. If episodes are frequent or severe, consult a doctor for medical treatment.","['_', '_']",[]
Other illeness Fits,coriander leaves or powder with hot water can helps for fits patient,"['_', '_']",[]
other illeness Remedies,please check the remedies for other illeness,"['_', '_']",[]
Cold Physical Activity,"Go jogging with natural and deep breathing, allowing yourself to inhale fresh air properly for about 20 minutes. After that, practice Surya Namaskar to help your body absorb more oxygen for an extended period. Finally, perform Pranayama only if needed to further enhance your breathing and overall well-being.","['_', '_']",[]
BP,Let me know which type of services do you want for BP?,[],[]
Cold Ayurvedic Remedies,"Take fresh Tulasi leaves, grind them into a paste, and filter the extract using a cloth. Add one spoon of pepper powder to the extract and drink it with water in the morning and evening. Due to its antiviral properties, this remedy helps relieve cough and a sore throat",['_'],[]
Diarrhea Remedies,Please let me know which type of remedies do you want?,['_'],[]
heatwaves Diets,"Drink more water stored in a mud pot, as it has a natural cooling effect. Consume juices made from seasonal fruits. Eat curd rice and drink buttermilk, which are rich in probiotics. Include fruits like muskmelon and watermelon in your diet. Also, eat sabudana (sago) for better digestion and energy",['_'],"['(', ')']"
Fever Home Remedies,"Take 5 grams of coriander seeds (Dhaniyalu), 3 grams of cumin seeds (Jeelakarra), and 5 grams of ginger, and lightly crush them. Add this mixture to a glass of boiling water and let it simmer until the liquid reduces to one-fourth of its original quantity. Strain the decoction and drink it warm to help reduce fever and chills if your symptoms getting worse please consult your doctor",['_'],"['(', ')', '(', ')']"
Confirm Dengue,"This symptoms looks like dengue fever,Dengue fever is a viral infection transmitted by mosquitoes,I it is very important to consult your doctor for good treatment",['_'],[]
heatwaves Symptom Check,please check your symptoms,"['_', '_']",[]
