intent,response,intent_special_chars,response_special_chars
Constipation Yoga,"It is good to practice Malasana, as it provides multiple health benefits, including improved digestion, flexibility, and better blood circulation",['_'],[]
Stress,let me know which type of services do you want?,[],[]
Diarrhea Medication,"LOPAMIDE (Lopamide hydrochloride tablets I.P.)  Dose-2mg cause-Lopamide Tablet is an anti-diarrhoeal medication. It works by slowing down the contraction of the intestines thereby decreasing the speed at which the contents pass through it. This allows more time for reabsorption of fluids and nutrients, making the stools more solid and less frequent.",['_'],"['(', ')']"
BP yoga,Practice Sasankasana and Sheetkari Pranayama (Cooling Pranayama) to help manage blood pressure.,['_'],"['(', ')']"
Diarrhea,which type of services do you want for Diarrhea?,[],[]
Fever,which type of service do you need for fever?,[],[]
BP yoga,Practice Sasankasana and Sheetkari Pranayama (Cooling Pranayama) to help manage blood pressure.,['_'],"['(', ')']"
Confirm Common Fever,"Fever is usually a sign that your body is fighting an infection, If the fever persists for more than 3 days or is very high, consult a doctor. Let me know if you need home remedies or care tips!","['_', '_']","['""']"
Constipation Yoga,"It is good to practice Malasana, as it provides multiple health benefits, including improved digestion, flexibility, and better blood circulation",['_'],[]
Confirm Loose Motions,This seems like loose motions symptoms i suggest you to please consult your doctor or if you want any remedies please check with me,"['_', '_']",[]
BP Naturopathy Remedies,Take curry leaves powder and mix it with water. Drink twice a day which helps controlling High BP,['_'],[]
Confirm Common Fever,"Fever is usually a sign that your body is fighting an infection, If the fever persists for more than 3 days or is very high, consult a doctor. Let me know if you need home remedies or care tips!","['_', '_']","['""']"
Hairfall Ayurvedi Remedie,"Take 1 cup of coconut milk, apply it to your scalp and all your hair, then cover your scalp with a warm towel. Wash it off. This should be done after a head bath",['_'],[]
Diarrhea Symptom Check,please check your symptoms do you have related to diarrhea,"['_', '_']",[]
Cough Remedies,Please let me know which type of remedies do you want?,['_'],[]
Cough Medication,"MONADRYL cough syrup (Diphenhydramine Hydrochloride, Ammonium Chloride , Sodium Chloride, Sodium Citrate & Menthol Syrup) dose-200mg 100ml cause-this Syrup helps to loosen thick mucus and reduces its stickiness, making it easier to cough out. This makes it easier for air to move in and out. It will also relieve allergy symptoms like watery eyes, sneezing, runny nose or throat irritation and help you carry out your daily activities more easily.",['_'],"['(', '&', ')']"
Other Constipation Symptoms,"I cannot determine other constipation-related symptoms. If you're experiencing severe or unusual symptoms, please consult your doctor for proper evaluation and guidance","['_', '_']",[]
Headache  Ayurvedic Remedies,Take a handful of coriander seeds (dhaniyalu) and mix them with a little water to make a thick paste. Apply this paste to the affected area (maadu),['_'],"['(', ')', '(', ')']"
Fever Naturopathy Remedies,"sleep with an cotton cloth which covers your body on an plain and even bed with a bedsheet on it and now cover your body with wet bead sheet and sleep for few minutes,this even helpful for your high temperature,even though you are repeating with your symptoms please consult your physician",['_'],[]
Cough Symptom Check,please check which type of symptoms do you have,"['_', '_']",[]
Default Fallback Intent,Can you say that again?,[],[]
Headache,let me know which type of services do you want?,[],[]
Other illeness Migraine,Mint leaves with hot water can helps to reduction of head ache(migraine) please check the severity and do accordingly,"['_', '_']","['(', ')']"
BP medication,"CARDIGLOW-H40(Telmisartan and Hydrochlorothiazide Tablets IP) dose-40mg, Cause-  used to treat high blood pressure (hypertension).please check the medicine while using and consult your doctor",['_'],"['(', ')', '(', ')']"
Other Cold Symptoms,"I'm here to provide general information, but I can't diagnose specific conditions or confirm if your symptoms indicate something more serious. If you're experiencing severe symptoms , or prolonged illness, it's best to consult a doctor for proper evaluation and treatment.","['_', '_']","['""']"
Stress Symptom Check,please check  if you have any of the  stress symptoms,"['_', '_']",[]
Confirm Physical Stress,"Physical stress occurs when the body is overworked due to excessive physical activity,To manage physical stress, get enough rest, stay hydrated, eat a balanced diet, and practice relaxation techniques like stretching or deep breathing,If symptoms persist, consult a doctor","['_', '_']",[]
Headache,let me know which type of services do you want?,[],[]
heatwaves,let me know which type of services do you want for heatwaves?,[],[]
Fever,which type of service do you need for fever?,[],[]
Vomitings Naturopathy Remedies,"Take warm water mixed with salt and drink it quickly until your stomach feels full. This will induce vomiting within minutes, helping to relieve discomfort.",['_'],"['""', '""']"
Confirm Dry Cough,"Dry cough, also known as a non-productive cough, is a common respiratory symptom that can be caused by various factors such as viral infections, allergies, environmental irritants, asthma, gastroesophageal diseases, and respiratory tract infections so please consult your doctor and poceed based on your symptoms","['_', '_']",[]
other illeness Remedies,please check the remedies for other illeness,"['_', '_']",[]
Confirm Emotional Stress,"Emotional stress can impact both mental and physical well-being, To manage emotional stress, try relaxation techniques, meditation, deep breathing, and talking to a trusted person. If stress becomes overwhelming, consider seeking professional support","['_', '_']",[]
Cold Ayurvedic Remedies,"Take fresh Tulasi leaves, grind them into a paste, and filter the extract using a cloth. Add one spoon of pepper powder to the extract and drink it with water in the morning and evening. Due to its antiviral properties, this remedy helps relieve cough and a sore throat",['_'],[]
Constipation Naturopathy Remedies,"waking up early in the morning, drink two glasses of warm water that was stored in a copper vessel the previous day while sitting in a malasana position. Then, eat a pinch of ginger sprinkled with rock salt.",['_'],[]
acknowledge,"Thank you for visiting our medibot! I’m here to assist you with  remedies, and symptom checks,Diet,physical activities, Let me know how I can help!",[],"['’', '""']"
Other BP Symptoms,"I understand that you're experiencing other BP symptoms. Since this bot is limited in providing medical diagnoses, I highly recommend consulting a qualified doctor for proper evaluation and treatment","['_', '_']",[]
Cough Ayurvedic Remedies,"Chew and eat garlic, as it has antibacterial and antiviral properties. Additionally, take some turmeric with honey to soothe the throat and reduce irritation.

Another effective remedy: To take Karakkaya (Haritaki) powder, add it to boiling water, and let it steep. Pour it into a glass, add some honey, and drink it twice a day for best results.",['_'],"[':', '(', ')']"
Fever,which type of service do you need for fever?,[],[]
Confirm Tension Headache,"Tension headaches are the most common type of headache,To relieve it, try relaxation techniques, stay hydrated, get enough rest, and avoid stress triggers. If headaches persist frequently, consult a doctor","['_', '_']",[]
Hairfall Naturopathy Remedies,"Take Drumstick leaves 2 cups,half cup curd,1/3cup amla powder make whole as paste and apply to your scalp and let it be half an hour and dhead bath,do this twice a week  which helps for mosturizing your scalp",['_'],['/']
Confirm Common Fever,"Fever is usually a sign that your body is fighting an infection, If the fever persists for more than 3 days or is very high, consult a doctor. Let me know if you need home remedies or care tips!","['_', '_']","['""']"
Confirm Mental Stress,"Mental stress can affect your thoughts, emotions, and overall well-being,To manage mental stress, try mindfulness, deep breathing, meditation, and taking breaks.if the symptoms are getting worse please professionals help which can beneficial","['_', '_']",[]
Confirm Wet Cough,"Wet cough, also known as a productive cough, is characterized by mucus or phlegm production. It can be caused by several conditions so please consult physician for better treatment","['_', '_']",[]
Confirm Emotional Stress,"Emotional stress can impact both mental and physical well-being, To manage emotional stress, try relaxation techniques, meditation, deep breathing, and talking to a trusted person. If stress becomes overwhelming, consider seeking professional support","['_', '_']",[]
Default Welcome Intent,Hi! How are you doing?,[],[]
Cough Naturopathy Remedies,"Chew a neem stick and spit it out. The bitterness helps reduce toxins and keeps your mouth fresh. Additionally, do facial steam inhalation by adding turmeric to the water for better respiratory health and a refreshing effect.",['_'],[]
Hairfall Remedies,Please let me know which type of remedies do you want?,['_'],[]
Hairfall,Which type of services do you want for Hairfall?,[],[]
Diarrhea Symptom Check,please check your symptoms do you have related to diarrhea,"['_', '_']",[]
Stress Home Remedie,take 3 to 4 Tulasi leaves chew and swallow reduces stress and pressure and improves the energy,['_'],[]
Confirm Mental Stress,"Mental stress can affect your thoughts, emotions, and overall well-being,To manage mental stress, try mindfulness, deep breathing, meditation, and taking breaks.if the symptoms are getting worse please professionals help which can beneficial","['_', '_']",[]
Fever Symptom Check,please choose the fever symptoms most relevant to you,"['_', '_']",[]
Constipation,which services do you want for Constipation?,[],[]
Diarrhea Diet,"while you are suffering with loose motions it is good to keep body more hydrated so that drink water eventually with gaps low consumption, drink coconut water with which contains electrolytes some pleople want more so add electral  powder to it and drink and for solid food eat curd rice",['_'],[]
Diarrhea Home Remedies,"Take a pinch of sunnam (lime powder) and half a teaspoon of cumin seeds (jelakarra).Crush them together in your hand,Consume the mixture.After that, drink some warm water for gum motions",['_'],"['(', ')', '(', ')']"
Confirm common Cold,"It looks like you may have common cold symptoms (caused by the Rhinovirus), which can result from allergies, infections, low immunity, or exposure to infected individuals. If you’d like, I can suggest remedies, diet tips, and activities to help manage your symptoms. For further evaluation, please consult a doctor.","['_', '_']","['(', ')', '’', '""']"
heatwaves Symptom Check,please check your symptoms,"['_', '_']",[]
Diarrhea Medication,"LOPAMIDE (Lopamide hydrochloride tablets I.P.)  Dose-2mg cause-Lopamide Tablet is an anti-diarrhoeal medication. It works by slowing down the contraction of the intestines thereby decreasing the speed at which the contents pass through it. This allows more time for reabsorption of fluids and nutrients, making the stools more solid and less frequent.",['_'],"['(', ')']"
Confirm Malaria,It seem like malaria symptoms I would suggest you to please consult your doctor,['_'],[]
Cold Ayurvedic Remedies,"Take fresh Tulasi leaves, grind them into a paste, and filter the extract using a cloth. Add one spoon of pepper powder to the extract and drink it with water in the morning and evening. Due to its antiviral properties, this remedy helps relieve cough and a sore throat",['_'],[]
Hairfall Naturopathy Remedies,"Take Drumstick leaves 2 cups,half cup curd,1/3cup amla powder make whole as paste and apply to your scalp and let it be half an hour and dhead bath,do this twice a week  which helps for mosturizing your scalp",['_'],['/']
Fever Home Remedies,"Take 5 grams of coriander seeds (Dhaniyalu), 3 grams of cumin seeds (Jeelakarra), and 5 grams of ginger, and lightly crush them. Add this mixture to a glass of boiling water and let it simmer until the liquid reduces to one-fourth of its original quantity. Strain the decoction and drink it warm to help reduce fever and chills if your symptoms getting worse please consult your doctor",['_'],"['(', ')', '(', ')']"
Constipation Yoga,"It is good to practice Malasana, as it provides multiple health benefits, including improved digestion, flexibility, and better blood circulation",['_'],[]
Cough Naturopathy Remedies,"Chew a neem stick and spit it out. The bitterness helps reduce toxins and keeps your mouth fresh. Additionally, do facial steam inhalation by adding turmeric to the water for better respiratory health and a refreshing effect.",['_'],[]
Constipation Naturopathy Remedies,"waking up early in the morning, drink two glasses of warm water that was stored in a copper vessel the previous day while sitting in a malasana position. Then, eat a pinch of ginger sprinkled with rock salt.",['_'],[]
Vomitings Home Remedies,"Take equal amounts of ginger and onion, grind them into a paste, and filter it to extract the liquid. Consume this liquid every 2 hours and observe the result.",['_'],[]
Default Welcome Intent,Greetings! How can I assist?,[],[]
Cold  Remedies,Let me  know which type of remedies do you want?,['_'],[]
Hairfall Ayurvedi Remedie,"Take 1 cup of coconut milk, apply it to your scalp and all your hair, then cover your scalp with a warm towel. Wash it off. This should be done after a head bath",['_'],[]
Hairfall Yoga,"Adho Mukha Svanasana (Downward-Facing Dog), Uttanasana (Standing Forward Bend), Vajrasana (Diamond Pose), and Balayam yoga (rubbing fingernails) please do asanas by practice",['_'],"['(', ')', '(', ')', '(', ')', '(', ')']"
Vomitings Remedies,Please let me know which type of remedies do you want?,['_'],[]
Cold Medication,"Cetirizine Tablets(cetirizine Hydrochloride I.T), dose-10mg (children 5mg),CETIRIZINE (se TI ra zeen) prevents and treats allergy symptoms, such as red, itchy eyes, sneezing, a runny or stuffy nose, or hives. It works by blocking histamine, a substance released by the body during an allergic reaction.",['_'],"['(', ')', '(', ')', '(', ')']"
Other BP Symptoms,"I understand that you're experiencing other BP symptoms. Since this bot is limited in providing medical diagnoses, I highly recommend consulting a qualified doctor for proper evaluation and treatment","['_', '_']",[]
Headache  Ayurvedic Remedies,Take a handful of coriander seeds (dhaniyalu) and mix them with a little water to make a thick paste. Apply this paste to the affected area (maadu),['_'],"['(', ')', '(', ')']"
Vomitings Remedies,Please let me know which type of remedies do you want?,['_'],[]
Other Headache Symptoms,"Headaches can come with various symptoms depending on the type and cause,so if you feel any of other symptoms consult physician","['_', '_']",[]
Constipation Symptom Check,please check your constipation symptoms,"['_', '_']",[]
Cold Medication,"Cetirizine Tablets(cetirizine Hydrochloride I.T), dose-10mg (children 5mg),CETIRIZINE (se TI ra zeen) prevents and treats allergy symptoms, such as red, itchy eyes, sneezing, a runny or stuffy nose, or hives. It works by blocking histamine, a substance released by the body during an allergic reaction.",['_'],"['(', ')', '(', ')', '(', ')']"
Confirm Dry Cough,"Dry cough, also known as a non-productive cough, is a common respiratory symptom that can be caused by various factors such as viral infections, allergies, environmental irritants, asthma, gastroesophageal diseases, and respiratory tract infections so please consult your doctor and poceed based on your symptoms","['_', '_']",[]
Confirm Typhoid,"Typhoid is a bacterial infection that can cause high fever, weakness, and digestive issues.  it's good to consult a doctor for proper diagnosis and treatment. Let me know if you need home remedies or diet tips",['_'],[]
Other Constipation Symptoms,"I cannot determine other constipation-related symptoms. If you're experiencing severe or unusual symptoms, please consult your doctor for proper evaluation and guidance","['_', '_']",[]
Vomitings Symptom Check,please check the  vomitings symptoms,"['_', '_']",[]
Other Fever Symptoms,If you feel like some other symptoms with fever or any difficulty in your symptoms please consult your physician,"['_', '_']",[]
Constipation Ayurvedic Remedies,Eat Neem fruit and spit out the seeds. This helps with good bowel movements,['_'],[]
heatwaves,let me know which type of services do you want for heatwaves?,[],[]
Confirm Tension Headache,"Tension headaches are the most common type of headache,To relieve it, try relaxation techniques, stay hydrated, get enough rest, and avoid stress triggers. If headaches persist frequently, consult a doctor","['_', '_']",[]
Cold Diet,"Make sure to maintain good water intake and consume fluids like buttermilk and soups. Also, add fruits and vegetables such as broccoli, cranberries, and blueberries, along with green tea and red onions, to support your overall health.",['_'],[]
Default Welcome Intent,Good day! What can I do for you today?,[],[]
heatwaves,let me know which type of services do you want for heatwaves?,[],[]
Constipation Home Remedies,"Take 5 grams of ginger and 5 grams of jaggery, grind them well, and eat this at night and drink some water which helps for constipation problem",['_'],[]
Confirm Common Fever,"Fever is usually a sign that your body is fighting an infection, If the fever persists for more than 3 days or is very high, consult a doctor. Let me know if you need home remedies or care tips!","['_', '_']","['""']"
Other Fever Symptoms,If you feel like some other symptoms with fever or any difficulty in your symptoms please consult your physician,"['_', '_']",[]
Headache Diet,"1.Increase water intake to 4 to 5 liters per day to help keep your body cool.
                                                         2.
Drinking enough water supports regular bowel movements (twice a day), helping to cleanse your stomach.
                                                          3.
Maintain a 2-hour gap between drinking water and meals for better digestion.
                                                            4.
Include fresh fruits in your diet for breakfast and in the evening.
                                                             5.
Take regular head baths to stay refreshed.
                                                         6.
Avoid coffee and tea for better health",['_'],"['(', ')']"
Other Heat Waves Symptoms,"In addition to common heat wave symptoms, other signs to feel,please consult doctor immediately","['_', '_', '_']","['""']"
Hairfall Home Remedies,"Take onion paste and apply it to your scalp. Let it dry for half an hour, then take a head bath. This helps with hair growth, reduces hair fall, and improves blood circulation to the scalp",['_'],[]
Vomitings Ayurvedic Remedies,"This remedie is useful for healing vomitings,Take equal amounts of cloves (lavangam), cumin seeds (jelakarra), cinnamon (dhalchinachakka), and cardamom. Add a little water and grind them into a paste. Mix this paste with honey and consume it for better health benefits.",['_'],"['(', ')', '(', ')', '(', ')']"
BP remedies,Please let me know which type of BP remedies do you want?,['_'],[]
Diarrhea Naturopathy Remedies,"Grind tender pomegranate fruit or pomegranate flowers into a smooth paste. Add a pinch of edible camphor(pacha karpooram) to this paste, Form small balls(small size soap nut) from the mixture. Consuming these balls with buttermilk can help relieve diarrhea                                                                                                                       please do check the goodness in your body after taking this or if you feel any dis comfort please consult your doctor",['_'],"['(', ')', '(', ')']"
Cold Symptom Check,could you please tell me which type of cold symptoms do you have?,"['_', '_']",[]
Hairfall Remedies,Please let me know which type of remedies do you want?,['_'],[]
Confirm Physical Stress,"Physical stress occurs when the body is overworked due to excessive physical activity,To manage physical stress, get enough rest, stay hydrated, eat a balanced diet, and practice relaxation techniques like stretching or deep breathing,If symptoms persist, consult a doctor","['_', '_']",[]
Vomitings Naturopathy Remedies,"Take warm water mixed with salt and drink it quickly until your stomach feels full. This will induce vomiting within minutes, helping to relieve discomfort.",['_'],"['""', '""']"
Confirm Cluster Headache,"Cluster headaches are extremely painful headaches that occur in cycles, usually affecting one side of the head, often around the eye,To manage symptoms, maintain a consistent sleep schedule, avoid known triggers, and practice relaxation techniques. If episodes are frequent or severe, consult a doctor for medical treatment.","['_', '_']",[]
Cough Medication,Chlorpheniramine Maleate-2mg +dextromethorphan Hydrobromide-10mg,['_'],['+']
Diarrhea Ayurvedic Remedies,"karakkaya(Haritaki),Thanikaya(Bibhitaki),Amla(Bibhitaki),kaachu(chandr chakra saaram) take all these into powder as 5grams and mix it with butter milk and drink this can help for loose,motions gum motions, and blood motions",['_'],"['(', ')', '(', ')', '(', ')', '(', ')']"
Headache Symptom check,please check your head ache symptoms,"['_', '_']",[]
Confirm Tension Headache,"Tension headaches are the most common type of headache,To relieve it, try relaxation techniques, stay hydrated, get enough rest, and avoid stress triggers. If headaches persist frequently, consult a doctor","['_', '_']",[]
Welocme Intent,"Welcome to our MedicalBot, these are the service available in this bot.",['_'],[]
Vomitings Remedies,Please let me know which type of remedies do you want?,['_'],[]
Cough Naturopathy Remedies,"Chew a neem stick and spit it out. The bitterness helps reduce toxins and keeps your mouth fresh. Additionally, do facial steam inhalation by adding turmeric to the water for better respiratory health and a refreshing effect.",['_'],[]
Stress yoga,"Chandra Bhedana Pranayama – This practice stimulates the parasympathetic nervous system, helping to relax both the brain and body, promoting a sense of calmness.

Chandra Nadi Pranayama – A cooling and soothing breathing technique that helps balance emotions and reduces stress.

Bhramari Pranayama – Encourages positive thinking by stimulating the amygdala and relaxing the hypothalamus, which helps in emotional regulation and mental calmness.

Sheetali Pranayama – Lowers core body temperature, providing a cooling effect that leaves the body feeling refreshed and relaxed.",['_'],"['–', '–', '–', '–']"
Confirm Common Constipation,"I can't determine other constipation-related symptoms. If you're experiencing severe or unusual symptoms, please consult your doctor for proper evaluation and guidance","['_', '_']",[]
Stress,let me know which type of services do you want?,[],[]
heatwaves Remedies,please tell me which type of remedies do you want?,['_'],[]
Other Headache Symptoms,"Headaches can come with various symptoms depending on the type and cause,so if you feel any of other symptoms consult physician","['_', '_']",[]
Stress Symptom Check,please check  if you have any of the  stress symptoms,"['_', '_']",[]
Diarrhea Naturopathy Remedies,"Grind tender pomegranate fruit or pomegranate flowers into a smooth paste. Add a pinch of edible camphor(pacha karpooram) to this paste, Form small balls(small size soap nut) from the mixture. Consuming these balls with buttermilk can help relieve diarrhea                                                                                                                       please do check the goodness in your body after taking this or if you feel any dis comfort please consult your doctor",['_'],"['(', ')', '(', ')']"
Cold Diet,"Make sure to maintain good water intake and consume fluids like buttermilk and soups. Also, add fruits and vegetables such as broccoli, cranberries, and blueberries, along with green tea and red onions, to support your overall health.",['_'],[]
Hairfall Home Remedies,"Take onion paste and apply it to your scalp. Let it dry for half an hour, then take a head bath. This helps with hair growth, reduces hair fall, and improves blood circulation to the scalp",['_'],[]
Other Diarrhea Symptoms,"I Cannot determine other diarrhea-related symptoms. If you're experiencing severe or unusual symptoms, please consult your doctor for proper evaluation and guidance.","['_', '_']",[]
Diarrhea Symptom Check,please check your symptoms do you have related to diarrhea,"['_', '_']",[]
other illeness,"Iam providing some remedies for othre illeness like Piles,Migraine,fits please check them",['_'],[]
Fever Naturopathy Remedies,"sleep with an cotton cloth which covers your body on an plain and even bed with a bedsheet on it and now cover your body with wet bead sheet and sleep for few minutes,this even helpful for your high temperature,even though you are repeating with your symptoms please consult your physician",['_'],[]
Fever Symptom Check,please choose the fever symptoms most relevant to you,"['_', '_']",[]
Cold Ayurvedic Remedies,"Take fresh Tulasi leaves, grind them into a paste, and filter the extract using a cloth. Add one spoon of pepper powder to the extract and drink it with water in the morning and evening. Due to its antiviral properties, this remedy helps relieve cough and a sore throat",['_'],[]
